{
  "schema_version": 1,
  "plan_id": "offline-smoke-v1",
  "title": "离线 Agent 工作流验证",
  "world_name": "Marx Video Test",
  "dimension": "minecraft:overworld",
  "objective": "只编译和记录测试场景命令，不连接或修改 Minecraft",
  "build_region": {
    "start": {"x": -16, "y": 60, "z": -16},
    "end": {"x": 16, "y": 72, "z": 16}
  },
  "actions": [
    {
      "type": "set_time",
      "value": 6000
    },
    {
      "type": "set_weather",
      "weather": "clear",
      "duration_seconds": 300
    },
    {
      "type": "fill",
      "start": {"x": 0, "y": 64, "z": 0},
      "end": {"x": 4, "y": 64, "z": 4},
      "block": "minecraft:stone_bricks",
      "placement": "keep"
    },
    {
      "type": "mocap_playback_start",
      "name": "test_take"
    }
  ],
  "expected_artifacts": []
}

